{
  "$schema": "../schemas/training-data.schema.json",
  "schema_version": "1.0.0", "capability_id": "reasoning-knowledge", "updated": "2026-08-24",
  "selection_principles": ["Separate final-answer correctness from reasoning-style supervision.", "Prefer verifiable math, code, and structured tasks for RLVR.", "Do not claim target-language reasoning transfer until native prompts and answers are independently checked."],
  "sources": [
    {"id": "dolci-think-7b", "name": "Dolci Think SFT 7B decontaminated", "catalogue_entry": "openeurollm-dolci-think-sft-7b-decontaminated/0.0.0/README.md", "source_url": null, "source_kind": "catalogue", "decision": "use", "trainable": true, "stages": ["sft"], "roles": ["reasoning SFT backbone"], "language_scope": ["eng_Latn"], "reason": "Project-native decontaminated reasoning source sized for broad mixing.", "required_gates": ["solution verification sample", "benchmark overlap scan", "trace-style audit"], "eval_overlap_risk": "high"},
    {"id": "dolci-think-32b", "name": "Dolci Think SFT 32B decontaminated", "catalogue_entry": "openeurollm-dolci-think-sft-32b-decontaminated/0.0.0/README.md", "source_url": null, "source_kind": "catalogue", "decision": "pilot", "trainable": true, "stages": ["sft"], "roles": ["hard reasoning", "teacher diversity"], "language_scope": ["eng_Latn"], "reason": "Higher-capacity teacher traces for the 30B route, subject to quality and verbosity ablations.", "required_gates": ["difficulty distribution", "correctness sample", "contamination scan"], "eval_overlap_risk": "high"},
    {"id": "nemotron-posttrain", "name": "Nemotron Post-Training Dataset v2 decontaminated", "catalogue_entry": "openeurollm-nemotron-post-training-dataset-v2-decontaminated/0.0.0/README.md", "source_url": null, "source_kind": "catalogue", "decision": "pilot", "trainable": true, "stages": ["sft", "replay"], "roles": ["reasoning diversity", "general ability replay"], "language_scope": ["eng_Latn"], "reason": "Broad high-quality reasoning and instruction source with an OpenEuroLLM decontaminated derivative.", "required_gates": ["component-level provenance", "quality by source", "benchmark overlap evidence"], "eval_overlap_risk": "high"},
    {"id": "openr1-math", "name": "OpenR1-Math-220k", "catalogue_entry": "lumi-openr1-math-220k/0.0.0/README.md", "source_url": null, "source_kind": "catalogue", "decision": "pilot", "trainable": true, "stages": ["sft", "rlvr"], "roles": ["mathematical reasoning", "verifiable rewards"], "language_scope": ["eng_Latn"], "reason": "Concrete LUMI-staged math source for SFT and verifier experiments.", "required_gates": ["answer verifier replay", "train/eval family audit", "problem license mapping"], "eval_overlap_risk": "high"},
    {"id": "finnish-math", "name": "Finnish distilled math corpus", "catalogue_entry": "finnish-deepseek-distilled-math-corpus/0.0.0/README.md", "source_url": null, "source_kind": "catalogue", "decision": "pilot", "trainable": true, "stages": ["sft"], "roles": ["target-language reasoning experiment"], "language_scope": ["fin_Latn"], "reason": "Existing Finnish seed for comparing translated traces with target-language supervision.", "required_gates": ["native review", "solution verification", "translation/source overlap audit"], "eval_overlap_risk": "high"},
    {"id": "multilingual-reasoning-pilot", "name": "OpenEuroLLM multilingual reasoning traces v0.2 pilot", "catalogue_entry": null, "source_url": "https://huggingface.co/datasets/openeurollm/reasoning-traces-multilingual", "source_kind": "huggingface", "decision": "candidate", "trainable": false, "stages": ["sft"], "roles": ["multilingual trace ablation"], "language_scope": ["multilingual"], "reason": "Promising 3,425-row pilot across 37 target languages; automated gates are documented, while native-speaker and solver validation remain incomplete.", "required_gates": ["catalogue nomination", "native-speaker audit", "independent solver validation", "source-task decontamination"], "eval_overlap_risk": "high"},
    {"id": "medical-reasoning", "name": "EU medical post-train v1", "catalogue_entry": "birgermoell-oellm-eu-medical-posttrain-v1/0.0.0/README.md", "source_url": null, "source_kind": "catalogue", "decision": "candidate", "trainable": false, "stages": ["sft", "preference"], "roles": ["medical uncertainty", "factual specialist pilot"], "language_scope": ["swe_Latn", "multilingual"], "reason": "High-stakes scope needs a separate safety case before it can become trainable.", "required_gates": ["clinical review", "privacy and license audit", "medical-eval separation", "uncertainty labeling"], "eval_overlap_risk": "high"}
  ],
  "mixing_guidance": ["Use verified final answers as the primary quality signal and treat visible traces as an ablated technique.", "Cap reasoning-token inflation and retain ordinary instruction replay.", "Run English-first baselines before adding target-language traces so transfer effects are attributable."],
  "gaps": ["Native multilingual verifier bank", "Protected medical/factual calibration suite", "Trace-language policy", "Contamination ledger linking every source family to public benchmarks"]
}
