{
  "$schema": "../schemas/training-data.schema.json",
  "schema_version": "1.0.0", "capability_id": "efficiency-release", "updated": "2026-08-24",
  "selection_principles": ["Calibration data must be representative training-distribution samples, never protected evaluation rows.", "Stratify by language tier, capability, sequence length, and output format.", "Pin every calibration sample and transformation for reproducibility."],
  "sources": [
    {"id": "general-calibration", "name": "Dolci SFT decontaminated calibration stratum", "catalogue_entry": "openeurollm-dolci-instruct-sft-decontaminated/0.0.0/README.md", "source_url": null, "source_kind": "derived", "decision": "candidate", "trainable": true, "stages": ["calibration"], "roles": ["general instruction calibration"], "language_scope": ["eng_Latn"], "reason": "Representative general-instruction stratum drawn only from the training split.", "required_gates": ["publish sample IDs and hash", "confirm train-split membership", "license inheritance"], "eval_overlap_risk": "low"},
    {"id": "multilingual-calibration", "name": "Dolci translated calibration strata", "catalogue_entry": "openeurollm-dolci-instruct-sft-translated/0.0.0/README.md", "source_url": null, "source_kind": "derived", "decision": "candidate", "trainable": true, "stages": ["calibration"], "roles": ["language-tier calibration"], "language_scope": ["multilingual"], "reason": "Provides target-language activation distributions for quantization qualification.", "required_gates": ["balanced per-language sample", "publish IDs and hash", "train-split membership"], "eval_overlap_risk": "low"},
    {"id": "reasoning-calibration", "name": "Dolci Think 7B calibration stratum", "catalogue_entry": "openeurollm-dolci-think-sft-7b-decontaminated/0.0.0/README.md", "source_url": null, "source_kind": "derived", "decision": "candidate", "trainable": true, "stages": ["calibration"], "roles": ["reasoning activation calibration"], "language_scope": ["eng_Latn"], "reason": "Retains long reasoning-token and numeric behavior during quantization.", "required_gates": ["publish sample IDs and hash", "difficulty stratification", "train-split membership"], "eval_overlap_risk": "low"},
    {"id": "tool-calibration", "name": "EU tool-use calibration stratum", "catalogue_entry": "birgermoell-oellm-eu-tooluse-v1/0.0.0/README.md", "source_url": null, "source_kind": "derived", "decision": "candidate", "trainable": true, "stages": ["calibration"], "roles": ["JSON and function-call calibration"], "language_scope": ["eng_Latn", "code"], "reason": "Preserves structured-output token distributions.", "required_gates": ["publish sample IDs and hash", "schema diversity", "train-split membership"], "eval_overlap_risk": "low"},
    {"id": "long-calibration", "name": "Natural 128k/256k calibration slices", "catalogue_entry": "birgermoell-oellm-longctx-tokenized-natural-128k-256k-pilot-v1/0.0.0/README.md", "source_url": null, "source_kind": "derived", "decision": "candidate", "trainable": true, "stages": ["calibration"], "roles": ["long-context calibration"], "language_scope": ["multilingual"], "reason": "Ensures long-sequence activation and cache behavior is included in qualification.", "required_gates": ["length-stratified sample", "publish IDs and hash", "memory-safe calibration method"], "eval_overlap_risk": "low"},
    {"id": "eval-holdouts-excluded", "name": "EU evaluation holdouts", "catalogue_entry": "birgermoell-oellm-eu-eval-holdouts-v1/0.0.0/README.md", "source_url": null, "source_kind": "catalogue", "decision": "exclude", "trainable": false, "stages": [], "roles": ["explicit negative control"], "language_scope": ["multilingual"], "reason": "Protected evaluation is never calibration or training data.", "required_gates": ["deny-list hashes in calibration builder"], "eval_overlap_risk": "prohibited"}
  ],
  "mixing_guidance": ["Publish a small deterministic calibration manifest per released quantization.", "Include every language tier and capability-relevant format.", "Evaluate quantizations on protected suites after calibration; never optimize the calibration sample against those answers."],
  "gaps": ["Named release owner", "Hardware-specific latency and throughput SLOs", "Canonical quantization formats", "Signed model/data/evaluation bill of materials"]
}
