{
  "$schema": "../schemas/training-data.schema.json",
  "schema_version": "1.0.0", "capability_id": "grounding-rag", "updated": "2026-08-24",
  "selection_principles": ["Pair every answer with the exact evidence span and document identity.", "Include answerable, unanswerable, conflicting, stale, and partially supported cases.", "Do not treat fluent unsupported answers as positive examples."],
  "sources": [
    {"id": "chatqa2", "name": "NVIDIA ChatQA2 long SFT data", "catalogue_entry": "nvidia-chatqa2-long-sft-data/0.0.0/README.md", "source_url": null, "source_kind": "catalogue", "decision": "pilot", "trainable": true, "stages": ["sft"], "roles": ["document QA", "retrieval-grounded response"], "language_scope": ["eng_Latn"], "reason": "Established document-grounded SFT candidate for initial baselines.", "required_gates": ["citation schema normalization", "source-document license audit", "eval overlap scan"], "eval_overlap_risk": "high"},
    {"id": "eng-fin-long-sft", "name": "English-Finnish long-context SFT", "catalogue_entry": "lumi-long-context-eng-fin-sft/0.0.0/README.md", "source_url": null, "source_kind": "catalogue", "decision": "pilot", "trainable": true, "stages": ["sft"], "roles": ["multilingual long-document QA", "synthesis"], "language_scope": ["eng_Latn", "fin_Latn"], "reason": "Concrete LUMI-staged route for connecting multilingual grounding and long context.", "required_gates": ["document-answer linkage audit", "no-answer slice", "deduplication"], "eval_overlap_risk": "high"},
    {"id": "booksum", "name": "BookSum", "catalogue_entry": "lumi-booksum/0.0.0/README.md", "source_url": null, "source_kind": "catalogue", "decision": "pilot", "trainable": true, "stages": ["sft"], "roles": ["long-document synthesis"], "language_scope": ["eng_Latn"], "reason": "Can teach evidence compression and long synthesis, but not citation behavior by itself.", "required_gates": ["license check", "book-level split", "hallucination audit"], "eval_overlap_risk": "high"},
    {"id": "native-source-family", "name": "EU native-language source family", "catalogue_entry": "per-language-wikipedia/0.0.0/README.md", "source_url": null, "source_kind": "derived", "decision": "candidate", "trainable": false, "stages": ["sft"], "roles": ["multilingual evidence documents", "freshness and citation generation"], "language_scope": ["all-release-languages"], "reason": "Native documents can seed synthetic grounded QA only after document licenses, snapshot IDs, and generated-answer verification are recorded.", "required_gates": ["define generation pipeline", "pin snapshots", "claim-evidence verifier", "held-out document split"], "eval_overlap_risk": "high"},
    {"id": "medical-grounding", "name": "EU medical post-train v1", "catalogue_entry": "birgermoell-oellm-eu-medical-posttrain-v1/0.0.0/README.md", "source_url": null, "source_kind": "catalogue", "decision": "candidate", "trainable": false, "stages": ["sft", "preference"], "roles": ["high-stakes source grounding", "escalation"], "language_scope": ["swe_Latn", "multilingual"], "reason": "Potential high-stakes grounding pilot, gated on expert and source review.", "required_gates": ["clinical review", "source currency policy", "citation verifier", "separate evaluation documents"], "eval_overlap_risk": "high"},
    {"id": "health-source-triage", "name": "birgermoell/swedish-health-source-triage", "catalogue_entry": null, "source_url": "https://huggingface.co/datasets/birgermoell/swedish-health-source-triage", "source_kind": "huggingface", "decision": "hold", "trainable": false, "stages": ["sft"], "roles": ["pipeline prototype", "source-type classification"], "language_scope": ["eng_Latn"], "reason": "Only 36 manually written teaching examples; the card explicitly says it is neither a medical system nor a benchmark. Use to prototype schemas, not to support capability claims.", "required_gates": ["catalogue nomination", "expand independently", "expert review", "separate training and evaluation cases"], "eval_overlap_risk": "prohibited"}
  ],
  "mixing_guidance": ["Train answerability and abstention together so refusal does not become the cheapest policy.", "Keep retrieval quality and generation quality separately measurable.", "Use document-level, not row-level, separation between train and evaluation."],
  "gaps": ["Protected multilingual RAG holdout", "Citation-span schema shared across sources", "Freshness/conflicting-source dataset", "Numeric promotion floor after base baseline"]
}
