{
  "$schema": "../schemas/training-data.schema.json",
  "schema_version": "1.0.0", "capability_id": "multilingual", "updated": "2026-08-24",
  "selection_principles": ["Allocate data by measured language deficit, not equal row counts.", "Preserve native-language data and distinguish translations from native text.", "Require script, locale, language-ID, provenance, and benchmark-overlap checks."],
  "sources": [
    {"id": "dolci-sft-translated", "name": "Dolci Instruct SFT translated", "catalogue_entry": "openeurollm-dolci-instruct-sft-translated/0.0.0/README.md", "source_url": null, "source_kind": "catalogue", "decision": "use", "trainable": true, "stages": ["sft"], "roles": ["broad translated instruction coverage"], "language_scope": ["ces_Latn", "deu_Latn", "ell_Grek", "spa_Latn", "fin_Latn", "fra_Latn", "ita_Latn", "pol_Latn", "ron_Latn", "swe_Latn", "ukr_Cyrl"], "reason": "Existing OpenEuroLLM translated SFT backbone.", "required_gates": ["translation quality by language", "language fidelity", "decontamination evidence"], "eval_overlap_risk": "medium"},
    {"id": "dolci-dpo-translated", "name": "Dolci Instruct DPO translated", "catalogue_entry": "openeurollm-dolci-instruct-dpo-translated/0.0.0/README.md", "source_url": null, "source_kind": "catalogue", "decision": "use", "trainable": true, "stages": ["preference"], "roles": ["multilingual preference alignment"], "language_scope": ["ces_Latn", "deu_Latn", "ell_Grek", "spa_Latn", "fin_Latn", "fra_Latn", "ita_Latn", "pol_Latn", "ron_Latn", "swe_Latn", "ukr_Cyrl"], "reason": "Existing preference counterpart to the translated SFT set.", "required_gates": ["chosen/rejected consistency", "translation quality", "benchmark decontamination"], "eval_overlap_risk": "medium"},
    {"id": "eu-instruct", "name": "EU-Instruct-Synthetic", "catalogue_entry": "openeurollm-eu-instruct-synthetic/0.0.0/README.md", "source_url": null, "source_kind": "catalogue", "decision": "pilot", "trainable": true, "stages": ["sft"], "roles": ["European instruction coverage", "weak-language repair"], "language_scope": ["multilingual"], "reason": "Project-native source for broad European coverage.", "required_gates": ["per-language counts", "native-speaker spot check", "synthetic-source audit"], "eval_overlap_risk": "medium"},
    {"id": "defect-repair", "name": "EU defect-repair SFT v1", "catalogue_entry": "birgermoell-oellm-eu-defect-repair-sft-v1/0.0.0/README.md", "source_url": null, "source_kind": "catalogue", "decision": "pilot", "trainable": true, "stages": ["sft"], "roles": ["targeted weak-language repair"], "language_scope": ["isl_Latn", "gle_Latn", "est_Latn", "hrv_Latn", "slv_Latn", "lit_Latn", "lav_Latn", "dan_Latn", "hun_Latn", "slk_Latn", "bul_Cyrl", "ron_Latn", "pol_Latn", "fin_Latn"], "reason": "Directly targets observed multilingual defects and thin languages.", "required_gates": ["immutable split", "manual correctness sample", "holdout-family exclusion"], "eval_overlap_risk": "high"},
    {"id": "wikipedia-replay", "name": "Per-language Wikipedia", "catalogue_entry": "per-language-wikipedia/0.0.0/README.md", "source_url": null, "source_kind": "catalogue", "decision": "pilot", "trainable": true, "stages": ["continued-pretraining", "replay"], "roles": ["language fluency", "knowledge replay"], "language_scope": ["all-release-languages"], "reason": "Native-language text can stabilize fluency where instruction data is synthetic or sparse.", "required_gates": ["snapshot pin", "language ID", "license attribution", "PII and markup filtering"], "eval_overlap_risk": "medium"},
    {"id": "reasoning-traces-pilot", "name": "OpenEuroLLM multilingual reasoning traces v0.2 pilot", "catalogue_entry": null, "source_url": "https://huggingface.co/datasets/openeurollm/reasoning-traces-multilingual", "source_kind": "huggingface", "decision": "candidate", "trainable": false, "stages": ["sft"], "roles": ["target-language reasoning experiment"], "language_scope": ["multilingual"], "reason": "Useful 37-language pilot, but its model card explicitly lacks systematic native-speaker audit and downstream-solver verification.", "required_gates": ["nominate to catalogue", "native-speaker audit", "solver verification", "pin revision", "exclude benchmark derivatives"], "eval_overlap_risk": "high"},
    {"id": "open-assistant-swedish", "name": "birgermoell/open_assistant_swedish", "catalogue_entry": null, "source_url": "https://huggingface.co/datasets/birgermoell/open_assistant_swedish", "source_kind": "huggingface", "decision": "hold", "trainable": false, "stages": ["sft"], "roles": ["possible Swedish chat data"], "language_scope": ["swe_Latn"], "reason": "The repository is discoverable but lacks the catalogue evidence needed for production use.", "required_gates": ["nominate to catalogue", "provenance and license", "schema and row audit", "quality and safety sample"], "eval_overlap_risk": "medium"}
  ],
  "mixing_guidance": ["Set mix weights from pre-SFT per-language deficits and cap translated-data dominance.", "Report results by tier and language, not only a single multilingual average.", "Retain English and high-resource replay while repairing lower tiers to avoid catastrophic drift."],
  "gaps": ["Tier-3 native instruction and preference data", "Maltese and Italian reconciliation with the declared language list", "Native-speaker review network", "Per-language data budgets and token counts"]
}
