{
  "$schema": "../schemas/training-data.schema.json",
  "schema_version": "1.0.0", "capability_id": "tools-agents", "updated": "2026-08-24",
  "selection_principles": ["Prefer trajectories with executable schemas, tool observations, and verifiable outcomes.", "Separate selection, argument generation, execution interpretation, recovery, and permission compliance.", "Preserve natural-language instruction quality through replay."],
  "sources": [
    {"id": "oellm-function-mix", "name": "OpenEuroLLM function-calling mixture 220", "catalogue_entry": "openeurollm-function-calling-mixture-220/0.0.0/README.md", "source_url": null, "source_kind": "catalogue", "decision": "use", "trainable": true, "stages": ["sft"], "roles": ["function selection", "argument generation"], "language_scope": ["eng_Latn"], "reason": "Project-native function-calling mixture already tied to the post-training catalogue.", "required_gates": ["schema validity", "duplicate family analysis", "execution sample"], "eval_overlap_risk": "high"},
    {"id": "eu-tooluse", "name": "EU tool-use v1", "catalogue_entry": "birgermoell-oellm-eu-tooluse-v1/0.0.0/README.md", "source_url": null, "source_kind": "catalogue", "decision": "pilot", "trainable": true, "stages": ["sft", "rlvr"], "roles": ["tool use", "verifier-backed tasks"], "language_scope": ["eng_Latn"], "reason": "Existing project artifact that can support both SFT and execution-verified work.", "required_gates": ["pin tool schemas", "sandbox replay", "permission annotation", "eval decontamination"], "eval_overlap_risk": "high"},
    {"id": "toolace", "name": "ToolACE", "catalogue_entry": "team-ace-toolace/0.0.0/README.md", "source_url": null, "source_kind": "catalogue", "decision": "pilot", "trainable": true, "stages": ["sft"], "roles": ["tool diversity", "parallel and nested calls"], "language_scope": ["eng_Latn"], "reason": "Broadens schema and tool-pattern coverage.", "required_gates": ["license confirmation", "schema replay", "benchmark overlap scan"], "eval_overlap_risk": "high"},
    {"id": "hermes-function", "name": "Hermes function calling v1", "catalogue_entry": "nousresearch-hermes-function-calling-v1/0.0.0/README.md", "source_url": null, "source_kind": "catalogue", "decision": "pilot", "trainable": true, "stages": ["sft", "replay"], "roles": ["function-calling diversity"], "language_scope": ["eng_Latn"], "reason": "Adds common function-calling patterns and negative examples.", "required_gates": ["normalize schemas", "deduplicate source families", "quality sample"], "eval_overlap_risk": "medium"},
    {"id": "glaive-function", "name": "Glaive function calling v2", "catalogue_entry": "glaiveai-glaive-function-calling-v2/0.0.0/README.md", "source_url": null, "source_kind": "catalogue", "decision": "pilot", "trainable": true, "stages": ["sft"], "roles": ["function calling", "no-call decisions"], "language_scope": ["eng_Latn"], "reason": "Useful source for selection and formatting after normalization.", "required_gates": ["license and provenance", "schema validity", "no-call balance"], "eval_overlap_risk": "medium"},
    {"id": "nemotron-agentic-v1", "name": "Nemotron Agentic v1 tool calling", "catalogue_entry": "nvidia-nemotron-agentic-v1-tool-calling/0.0.0/README.md", "source_url": null, "source_kind": "catalogue", "decision": "candidate", "trainable": true, "stages": ["sft", "rlvr"], "roles": ["longer trajectories", "recovery", "agentic tasks"], "language_scope": ["eng_Latn"], "reason": "Candidate for multi-step trajectories after executable replay and governance review.", "required_gates": ["trajectory execution", "tool-result integrity", "permission-policy mapping", "contamination audit"], "eval_overlap_risk": "high"},
    {"id": "xlam", "name": "xLAM function calling 60k", "catalogue_entry": "salesforce-xlam-function-calling-60k/0.0.0/README.md", "source_url": null, "source_kind": "catalogue", "decision": "candidate", "trainable": true, "stages": ["sft"], "roles": ["unseen-schema generalization"], "language_scope": ["eng_Latn"], "reason": "Candidate diversity source; run ablations against the existing mixture before inclusion.", "required_gates": ["license", "schema execution", "source-family overlap"], "eval_overlap_risk": "high"}
  ],
  "mixing_guidance": ["Normalize all sources to one canonical tool-call schema while retaining the upstream representation in provenance.", "Weight successful recovery and no-call examples explicitly.", "Do not train on generated tool outputs that cannot be reproduced."],
  "gaps": ["Target-language tool trajectories", "Permission and irreversible-action data", "Executable validation harness", "Long-horizon web and file tasks with protected outcomes"]
}
