{
  "$schema": "../schemas/training-data.schema.json",
  "schema_version": "1.0.0", "capability_id": "instruction-chat", "updated": "2026-08-24",
  "selection_principles": ["Prefer decontaminated, reconstructable conversation data with explicit turn roles.", "Balance task completion, natural dialogue, structured outputs, and calibrated refusal.", "Measure and cap source-family dominance."],
  "sources": [
    {"id": "dolci-sft-decontaminated", "name": "Dolci Instruct SFT decontaminated", "catalogue_entry": "openeurollm-dolci-instruct-sft-decontaminated/0.0.0/README.md", "source_url": null, "source_kind": "catalogue", "decision": "use", "trainable": true, "stages": ["sft"], "roles": ["general instruction backbone"], "language_scope": ["eng_Latn"], "reason": "Primary decontaminated OpenEuroLLM instruction source.", "required_gates": ["pin revision", "retain decontamination evidence", "schema validation"], "eval_overlap_risk": "medium"},
    {"id": "dolci-sft-translated", "name": "Dolci Instruct SFT translated", "catalogue_entry": "openeurollm-dolci-instruct-sft-translated/0.0.0/README.md", "source_url": null, "source_kind": "catalogue", "decision": "use", "trainable": true, "stages": ["sft"], "roles": ["multilingual instruction backbone"], "language_scope": ["multilingual"], "reason": "Extends the core instruction distribution to European languages.", "required_gates": ["translation quality", "language fidelity", "decontamination evidence"], "eval_overlap_risk": "medium"},
    {"id": "open-perfectblend", "name": "Open-PerfectBlend decontaminated", "catalogue_entry": "openeurollm-open-perfectblend-decontaminated/0.0.0/README.md", "source_url": null, "source_kind": "catalogue", "decision": "pilot", "trainable": true, "stages": ["sft", "replay"], "roles": ["high-quality general chat", "instruction diversity"], "language_scope": ["eng_Latn"], "reason": "Broadens style and task diversity around the primary Dolci backbone.", "required_gates": ["source-family analysis", "safety sample", "benchmark overlap scan"], "eval_overlap_risk": "medium"},
    {"id": "orca-agentinstruct", "name": "Orca AgentInstruct 1M v1 decontaminated", "catalogue_entry": "openeurollm-orca-agentinstruct-1m-v1-decontaminated/0.0.0/README.md", "source_url": null, "source_kind": "catalogue", "decision": "pilot", "trainable": true, "stages": ["sft"], "roles": ["complex instruction following", "agentic task style"], "language_scope": ["eng_Latn"], "reason": "Adds complex instructions but must be balanced against concise direct responses.", "required_gates": ["verbosity analysis", "decontamination evidence", "tool-result consistency sample"], "eval_overlap_risk": "medium"},
    {"id": "smoltalk2-preference", "name": "SmolTalk2 decontaminated", "catalogue_entry": "openeurollm-smoltalk2-decontaminated/0.0.0/README.md", "source_url": null, "source_kind": "catalogue", "decision": "pilot", "trainable": true, "stages": ["preference"], "roles": ["helpfulness preference", "style calibration"], "language_scope": ["eng_Latn"], "reason": "Candidate preference layer after SFT convergence.", "required_gates": ["preference consistency", "length-bias audit", "safety slice"], "eval_overlap_risk": "medium"},
    {"id": "oasst2", "name": "OpenAssistant OASST2", "catalogue_entry": "openassistant-oasst2/0.0.0/README.md", "source_url": null, "source_kind": "catalogue", "decision": "pilot", "trainable": true, "stages": ["sft", "replay"], "roles": ["multiturn conversation", "human-authored replay"], "language_scope": ["multilingual"], "reason": "Adds human dialogue and multilingual turns to a synthetic-heavy mix.", "required_gates": ["PII scan", "safety filtering", "language labeling", "license audit"], "eval_overlap_risk": "medium"},
    {"id": "personal-openassistant", "name": "birgermoell/open_assistant_dataset", "catalogue_entry": null, "source_url": "https://huggingface.co/datasets/birgermoell/open_assistant_dataset", "source_kind": "huggingface", "decision": "hold", "trainable": false, "stages": ["sft"], "roles": ["possible legacy chat source"], "language_scope": ["unknown"], "reason": "Large discoverable dataset, but the card does not establish lineage, license, transformations, or quality.", "required_gates": ["nominate to catalogue", "establish lineage against OASST", "license and PII audit", "deduplicate against OASST2"], "eval_overlap_risk": "medium"}
  ],
  "mixing_guidance": ["Start with a clean general backbone, then add multilingual and specialist strata through measured ablations.", "Keep format-following and short-answer examples visible; do not let long reasoning traces dominate ordinary chat.", "Preference optimization must be evaluated for length and sycophancy bias."],
  "gaps": ["Target-language structured-output data", "Native multilingual multi-turn preference data", "Owner for conversation style and system prompt", "Immutable train/dev split manifest"]
}
