{
  "$schema": "../schemas/training-data.schema.json",
  "schema_version": "1.0.0", "capability_id": "long-context", "updated": "2026-08-24",
  "selection_principles": ["Treat 128k as the release base, 256k as a qualified checkpoint, and longer lengths as experiments.", "Measure position, document type, language, and task separately.", "Preserve short-context instruction and reasoning quality through replay."],
  "sources": [
    {"id": "jouni-blend", "name": "Jouni Luoma long-context blend", "catalogue_entry": "lumi-long-context-sample/0.0.0/README.md", "source_url": null, "source_kind": "catalogue", "decision": "use", "trainable": true, "stages": ["continued-pretraining", "context-extension"], "roles": ["context-extension backbone"], "language_scope": ["multilingual", "code"], "reason": "Inspected 205 GB LUMI blend with completed 16k/64k/128k run evidence.", "required_gates": ["shared immutable manifest", "component weights", "license matrix", "tokenizer statistics"], "eval_overlap_risk": "medium"},
    {"id": "streamed-all-v2", "name": "Streamed multilingual long context v2", "catalogue_entry": "birgermoell-oellm-longctx-tokenized-streamed-all-v2/0.0.0/README.md", "source_url": null, "source_kind": "catalogue", "decision": "pilot", "trainable": true, "stages": ["context-extension"], "roles": ["portable multilingual context artifact"], "language_scope": ["multilingual"], "reason": "Published portable tokenized variant for reproducible experiments.", "required_gates": ["component provenance", "sequence-length histogram", "cross-document packing audit"], "eval_overlap_risk": "medium"},
    {"id": "natural-128k-256k", "name": "Natural 128k/256k pilot", "catalogue_entry": "birgermoell-oellm-longctx-tokenized-natural-128k-256k-pilot-v1/0.0.0/README.md", "source_url": null, "source_kind": "catalogue", "decision": "pilot", "trainable": true, "stages": ["context-extension"], "roles": ["release-length qualification", "natural-document retention"], "language_scope": ["multilingual"], "reason": "Direct fit for the proposed release lengths.", "required_gates": ["document-boundary audit", "position distribution", "baseline retrieval eval"], "eval_overlap_risk": "medium"},
    {"id": "structured-128k-256k", "name": "Structured 128k/256k v1", "catalogue_entry": "birgermoell-oellm-longctx-tokenized-structured-128k-256k-v1/0.0.0/README.md", "source_url": null, "source_kind": "catalogue", "decision": "pilot", "trainable": true, "stages": ["context-extension"], "roles": ["structured long-context ablation"], "language_scope": ["multilingual", "code"], "reason": "Allows natural-versus-structured context ablation at release lengths.", "required_gates": ["structure taxonomy", "duplicate analysis", "short-context regression run"], "eval_overlap_risk": "medium"},
    {"id": "superlong", "name": "Superlong 512k/1M/2M v2", "catalogue_entry": "birgermoell-oellm-longctx-tokenized-superlong-512k-1m-2m-v2/0.0.0/README.md", "source_url": null, "source_kind": "catalogue", "decision": "candidate", "trainable": true, "stages": ["context-extension"], "roles": ["experimental ultra-long checkpoint"], "language_scope": ["multilingual", "code"], "reason": "Keep outside the release-critical path until 128k/256k quality and serving are stable.", "required_gates": ["128k and 256k exit gates", "memory model", "position scaling ablation", "serving feasibility"], "eval_overlap_risk": "medium"},
    {"id": "eng-fin-long-sft", "name": "English-Finnish long-context SFT", "catalogue_entry": "lumi-long-context-eng-fin-sft/0.0.0/README.md", "source_url": null, "source_kind": "catalogue", "decision": "pilot", "trainable": true, "stages": ["sft"], "roles": ["long-context instruction retention", "document QA"], "language_scope": ["eng_Latn", "fin_Latn"], "reason": "Adds task supervision after context extension.", "required_gates": ["document QA correctness", "no-answer slice", "format and language audit"], "eval_overlap_risk": "high"},
    {"id": "longalign", "name": "LongAlign 10k", "catalogue_entry": "thudm-longalign-10k/0.0.0/README.md", "source_url": null, "source_kind": "catalogue", "decision": "candidate", "trainable": true, "stages": ["sft"], "roles": ["long instruction following"], "language_scope": ["eng_Latn"], "reason": "Candidate SFT diversity source after overlap and license review.", "required_gates": ["license", "length histogram", "benchmark overlap", "quality sample"], "eval_overlap_risk": "high"}
  ],
  "mixing_guidance": ["Qualify one length step at a time and retain a frozen short-context replay mixture.", "Choose natural-versus-structured proportions through ablations, not intuition.", "Do not advertise experimental 512k+ artifacts as a release capability."],
  "gaps": ["Immutable shared LUMI manifest for the 205 GB blend", "Target-language long SFT beyond Finnish", "Serving budget for 128k/256k", "Protected long-context synthesis and tool-use suites"]
}
