{
  "$schema": "../schemas/training-data.schema.json",
  "schema_version": "1.0.0", "capability_id": "coding", "updated": "2026-08-24",
  "selection_principles": ["Prefer tasks with executable tests and pinned environments.", "Separate code generation, defect repair, repository work, tool use, and security.", "Protect benchmark repositories and derivatives from training."],
  "sources": [
    {"id": "glaive-code", "name": "Glaive Code Assistant v3", "catalogue_entry": "lumi-glaive-code-assistant-v3/0.0.0/README.md", "source_url": null, "source_kind": "catalogue", "decision": "pilot", "trainable": true, "stages": ["sft"], "roles": ["code instruction SFT"], "language_scope": ["eng_Latn", "code"], "reason": "Concrete staged code assistant source on LUMI.", "required_gates": ["license and provenance", "deduplication", "unsafe-code scan", "language distribution"], "eval_overlap_risk": "high"},
    {"id": "rlvr-python", "name": "Python R1-format RLVR data", "catalogue_entry": "allenai-rlvr-code-data-python-r1-format-filtered/0.0.0/README.md", "source_url": null, "source_kind": "catalogue", "decision": "pilot", "trainable": true, "stages": ["sft", "rlvr"], "roles": ["test-verified Python", "RLVR"], "language_scope": ["eng_Latn", "code"], "reason": "Verifier-compatible code source for a bounded RL pilot.", "required_gates": ["execute tests in sandbox", "pin dependencies", "benchmark-family decontamination"], "eval_overlap_risk": "high"},
    {"id": "stack-v2", "name": "The Stack v2", "catalogue_entry": "the-stack-v2/0.0.0/README.md", "source_url": null, "source_kind": "catalogue", "decision": "candidate", "trainable": true, "stages": ["continued-pretraining", "replay"], "roles": ["code fluency", "language breadth"], "language_scope": ["code"], "reason": "Potential code replay source, gated on license, opt-out, and benchmark decontamination controls.", "required_gates": ["license filtering", "opt-out policy", "PII and secret scan", "benchmark repository exclusion"], "eval_overlap_risk": "high"},
    {"id": "am-code-mix", "name": "AM DeepSeek code mixture", "catalogue_entry": "lumi-am-deepseek-r1-think/0.0.0/README.md", "source_url": null, "source_kind": "catalogue", "decision": "candidate", "trainable": true, "stages": ["sft"], "roles": ["reasoning-plus-code diversity"], "language_scope": ["eng_Latn", "code"], "reason": "Staged mixture component, but component-level lineage and verification are needed before use.", "required_gates": ["component manifest", "execution sample", "license map", "benchmark overlap"], "eval_overlap_risk": "high"},
    {"id": "defect-repair", "name": "EU defect-repair SFT v1", "catalogue_entry": "birgermoell-oellm-eu-defect-repair-sft-v1/0.0.0/README.md", "source_url": null, "source_kind": "catalogue", "decision": "pilot", "trainable": true, "stages": ["sft"], "roles": ["multilingual defect-repair instructions"], "language_scope": ["multilingual", "code"], "reason": "Useful for testing whether code repair instructions remain usable in target languages.", "required_gates": ["code subset identification", "test execution", "language-quality sample"], "eval_overlap_risk": "high"},
    {"id": "eu-tooluse", "name": "EU tool-use v1", "catalogue_entry": "birgermoell-oellm-eu-tooluse-v1/0.0.0/README.md", "source_url": null, "source_kind": "catalogue", "decision": "pilot", "trainable": true, "stages": ["sft", "rlvr"], "roles": ["terminal and execution interface"], "language_scope": ["eng_Latn", "code"], "reason": "Connects code generation to verifiable tool execution.", "required_gates": ["sandbox policy", "execution replay", "permission annotation"], "eval_overlap_risk": "high"}
  ],
  "mixing_guidance": ["Do not start dedicated code RL until an owner, frozen benchmark policy, and executable harness exist.", "Use pass/fail execution rather than teacher preference whenever possible.", "Retain non-code instruction replay and track secure-code regressions."],
  "gaps": ["Named coding lead", "Dedicated secure-code training slice", "Repository-level repair data with acceptable terms", "Multilingual coding-instruction evaluation"]
}
