{
  "$schema": "../schemas/training-data.schema.json",
  "schema_version": "1.0.0", "capability_id": "safety", "updated": "2026-08-24",
  "selection_principles": [
    "Train both safe helpfulness and refusal calibration; harmful-request refusal alone is insufficient.",
    "Treat health escalation, manipulation, dependency, delusion reinforcement, cyber, CBRN, and agentic misuse as separate slices.",
    "Raw adversarial conversations are discovery evidence until transformed into reviewed safe completions."
  ],
  "sources": [
    {"id": "eu-safety-civic-v1", "name": "OpenEuroLLM EU safety/civic v1", "catalogue_entry": "oellm-eu-safety-civic-v1/0.0.0/README.md", "source_url": null, "source_kind": "planned", "decision": "candidate", "trainable": false, "stages": ["sft", "preference"], "roles": ["policy", "safe completion", "refusal calibration"], "language_scope": ["all-release-languages"], "reason": "This is the intended project-native safety artifact, but no canonical stored training artifact is recorded yet.", "required_gates": ["materialize artifact", "pin policy taxonomy", "native-language review", "deduplicate against safety eval"], "eval_overlap_risk": "high"},
    {"id": "oasst2-replay", "name": "OpenAssistant OASST2", "catalogue_entry": "openassistant-oasst2/0.0.0/README.md", "source_url": null, "source_kind": "catalogue", "decision": "pilot", "trainable": true, "stages": ["sft", "replay"], "roles": ["benign-helpfulness replay", "multiturn chat"], "language_scope": ["multilingual"], "reason": "Useful as a broad helpfulness anchor so safety repair does not cause blanket refusals.", "required_gates": ["license and provenance check", "PII scan", "unsafe-content filtering", "language labeling"], "eval_overlap_risk": "medium"},
    {"id": "medical-escalation", "name": "EU medical post-train v1", "catalogue_entry": "birgermoell-oellm-eu-medical-posttrain-v1/0.0.0/README.md", "source_url": null, "source_kind": "catalogue", "decision": "candidate", "trainable": true, "stages": ["sft", "preference"], "roles": ["health escalation", "uncertainty", "source-aware redirection"], "language_scope": ["swe_Latn", "multilingual"], "reason": "Can teach calibrated escalation and external-source redirection, not clinical competence claims.", "required_gates": ["clinical-safety review", "source-license audit", "separate all medical evaluation prompts"], "eval_overlap_risk": "high"},
    {"id": "wildchat-discovery", "name": "WildChat", "catalogue_entry": "wildchat/0.0.0/README.md", "source_url": null, "source_kind": "catalogue", "decision": "hold", "trainable": false, "stages": ["red-team-discovery"], "roles": ["threat discovery", "jailbreak pattern mining"], "language_scope": ["multilingual"], "reason": "Raw conversations can reveal failures but must not be treated as safe target behavior.", "required_gates": ["derive reviewed safe completions", "PII removal", "license decision", "eval decontamination"], "eval_overlap_risk": "high"},
    {"id": "synthetic-compassion", "name": "birgermoell/synthetic_compassion", "catalogue_entry": null, "source_url": "https://huggingface.co/datasets/birgermoell/synthetic_compassion", "source_kind": "huggingface", "decision": "hold", "trainable": false, "stages": ["sft"], "roles": ["possible supportive-response data"], "language_scope": ["unknown"], "reason": "Potentially relevant to supportive interaction, but it lacks a project catalogue entry and must be reviewed for dependency reinforcement and unsafe advice.", "required_gates": ["nominate to catalogue", "document license and provenance", "psychological-harm review", "quality sample"], "eval_overlap_risk": "high"},
    {"id": "counseling", "name": "birgermoell/counseling", "catalogue_entry": null, "source_url": "https://huggingface.co/datasets/birgermoell/counseling", "source_kind": "huggingface", "decision": "hold", "trainable": false, "stages": ["sft"], "roles": ["possible mental-health boundary data"], "language_scope": ["unknown"], "reason": "Sensitive-domain data must not enter training without provenance, consent, privacy, and expert safety review.", "required_gates": ["nominate to catalogue", "privacy and consent audit", "expert review", "license decision"], "eval_overlap_risk": "high"}
  ],
  "mixing_guidance": ["Keep benign-helpfulness replay in every safety pilot.", "Measure refusal calibration per language and threat class after every mix change.", "Use defense-in-depth classifiers at deployment; model refusals are not the sole mitigation."],
  "gaps": ["Named safety lead", "Canonical multilingual safety artifact", "Native-language adversarial review in all tiers", "Reviewed multi-turn psychological-harm data", "CBRN/cyber governance and external testing protocol"]
}
